[
  {
    "one_liner": "For Singapore drone-service operators flying repeat missions over Lim Chu Kang and Kranji farm clusters, fuse NParks' no-fly-zone polygons with CAAS's OneMap UAS layer and named farm-plot boundaries to auto-generate a legal flight-corridor and permit-need map before each mission, replacing manual per-flight zone lookups.",
    "region": "singapore",
    "bucket": "drone_and_aerial",
    "data_class": "non_imagery:geofence_dataset",
    "delta_claim": "Automates per-mission airspace-legality checks; not spray-dose or coverage mission planning.",
    "seed_urls": [
      {
        "url": "https://data.gov.sg/datasets/d_15457a8f67905fb6ed890fca2ebac5f7/view",
        "date": "2026-05-13",
        "tier": "A",
        "title": "Prohibited Drone flying areas at NParks Nature Reserves, Nature Parks and Gardens",
        "note": "GeoJSON, Open Data Licence, boundaries of 22 reserves/parks/gardens where drone flying is prohibited."
      },
      {
        "url": "https://www.caas.gov.sg/public-passengers/unmanned-aircraft/permitted-flying-areas-and-no-fly-zones",
        "date": "2026-09-03",
        "tier": "A",
        "title": "Permitted Flying Areas and No-Fly Zones - CAAS",
        "note": "CAAS page directs UA operators to the OneMap UAS layer for permitted-flying and permit-required areas."
      }
    ],
    "crowded_area_entered": true,
    "forcing_function": "Singapore Lim Chu Kang land-use change and farm lease expiries",
    "hunter_confidence": "medium"
  },
  {
    "one_liner": "For SFA's Lim Chu Kang farm-consolidation planners, combine the same NParks and CAAS drone-restriction layers with SLA's updated cadastral parcels to site shared drone launch, charging and data-relay pads across the newly co-located farms so flight-time coverage is maximised while every pad respects no-fly buffers.",
    "region": "singapore",
    "bucket": "drone_and_aerial",
    "data_class": "non_imagery:geofence_dataset",
    "delta_claim": "Optimises shared drone-infrastructure siting for flight-time coverage, not general facility or circularity layout.",
    "seed_urls": [
      {
        "url": "https://data.gov.sg/datasets/d_15457a8f67905fb6ed890fca2ebac5f7/view",
        "date": "2026-05-13",
        "tier": "A",
        "title": "Prohibited Drone flying areas at NParks Nature Reserves, Nature Parks and Gardens",
        "note": "GeoJSON, Open Data Licence, boundaries of 22 reserves/parks/gardens where drone flying is prohibited."
      },
      {
        "url": "https://www.caas.gov.sg/public-passengers/unmanned-aircraft/permitted-flying-areas-and-no-fly-zones",
        "date": "2026-09-03",
        "tier": "A",
        "title": "Permitted Flying Areas and No-Fly Zones - CAAS",
        "note": "CAAS page directs UA operators to the OneMap UAS layer for permitted-flying and permit-required areas."
      },
      {
        "url": "https://data.gov.sg/datasets?query=land&resultId=d_e7395d743076a2bcc487b0d12b9bf33b",
        "date": "2026-09-07",
        "tier": "A",
        "title": "SLA Cadastral Land Parcel",
        "note": "Parcel polygons, data from Nov 2025, last updated 7 Sep 2026, reusable licence."
      }
    ],
    "crowded_area_entered": false,
    "forcing_function": "Singapore Lim Chu Kang land-use change and farm lease expiries",
    "hunter_confidence": "medium"
  },
  {
    "one_liner": "For URA and SFA officials reviewing new Lim Chu Kang farm-parcel layouts, overlay NParks' protected-reserve boundary polygons with SLA's updated cadastral parcels to automatically flag any proposed plot that breaches ecological buffer-distance rules near Sungei Buloh or Kranji before construction begins.",
    "region": "singapore",
    "bucket": "drone_and_aerial",
    "data_class": "non_imagery:geofence_dataset",
    "delta_claim": "Flags ecological buffer violations pre-construction; not a multi-objective facility optimiser.",
    "seed_urls": [
      {
        "url": "https://data.gov.sg/datasets/d_15457a8f67905fb6ed890fca2ebac5f7/view",
        "date": "2026-05-13",
        "tier": "A",
        "title": "Prohibited Drone flying areas at NParks Nature Reserves, Nature Parks and Gardens",
        "note": "GeoJSON, Open Data Licence, boundaries of 22 reserves/parks/gardens where drone flying is prohibited."
      },
      {
        "url": "https://data.gov.sg/datasets?query=land&resultId=d_e7395d743076a2bcc487b0d12b9bf33b",
        "date": "2026-09-07",
        "tier": "A",
        "title": "SLA Cadastral Land Parcel",
        "note": "Parcel polygons, data from Nov 2025, last updated 7 Sep 2026, reusable licence."
      }
    ],
    "crowded_area_entered": false,
    "forcing_function": "Singapore Lim Chu Kang land-use change and farm lease expiries",
    "hunter_confidence": "medium"
  },
  {
    "one_liner": "For SFA and HDB managing multi-storey-carpark rooftop vegetable farms, fuse the BCA TR78-mandated periodic drone thermal facade and roof inspection imagery these buildings already undergo with per-site harvest logs, to flag which rooftops are losing crop output to heat or waterproofing defects the inspection already photographed but never linked to farming outcomes.",
    "region": "singapore",
    "bucket": "drone_and_aerial",
    "data_class": "raw_frames_with_metadata:thermal_inspection_archive",
    "delta_claim": "Links mandatory building-inspection thermal imagery to farm yield loss, a source no vertical-farm monitoring product uses.",
    "seed_urls": [
      {
        "url": "https://www1.bca.gov.sg/resources/newsroom/new-regulations-for-periodic-inspection-of-building-fa-ades-to-start-from-1-january-2022/",
        "date": "2021-10-21",
        "tier": "A",
        "title": "New Regulations for Periodic Inspection of Building Facades to start from 1 January 2022",
        "note": "BCA press release on TR78:2020, the world-first Technical Reference for drone facade inspections; BCA-recognised for PFI submissions."
      },
      {
        "url": "https://www.hdb.gov.sg/about-us/news-and-publications/press-releases/24032021-JTender-Closing-For-7-HDB-MSCP-Rooftop-Sites-For-Urban-Farming",
        "date": "2021-03-24",
        "tier": "A",
        "title": "Tender Closing For 7 HDB MSCP Rooftop Sites For Urban Farming",
        "note": "HDB press release confirming the multi-storey-carpark rooftop urban farming programme."
      }
    ],
    "crowded_area_entered": true,
    "hunter_confidence": "medium"
  },
  {
    "one_liner": "For Singapore Food Agency import-resilience planners, use sub-metre drone imagery from Malaysian smallholder partner archives such as Aonic and ProLadang service flights over Cameron Highlands and Johor vegetable plots too small for Sentinel-2's 10 m pixels, to detect plot-level crop-stress anomalies and estimate a finer-grained supply-shock lead time than existing satellite-based early-warning work.",
    "region": "singapore",
    "bucket": "drone_and_aerial",
    "data_class": "sub_metre_commercial",
    "delta_claim": "Plot-level drone resolution resolves smallholder fields Sentinel-2 cannot; a sensor delta, not a method transfer.",
    "seed_urls": [
      {
        "url": "https://resource.aonic.com/event/maha-2026/",
        "date": "2026-08-28",
        "tier": "A",
        "title": "MAHA 2026 - Aonic Resource Hub",
        "note": "Aonic showcased agricultural drone solutions for spraying/spreading efficiency."
      },
      {
        "url": "https://proladang.com.my/",
        "date": "2026-06-30",
        "tier": "A",
        "title": "AgriAssist | Precision Satellite Monitoring for Agriculture",
        "note": "ProLadang official page; satellite/AI pest-disease service for Malaysian paddy smallholders."
      }
    ],
    "crowded_area_entered": false,
    "restates": "run3:S21",
    "hunter_confidence": "medium"
  },
  {
    "one_liner": "For Singapore and Johor drone-service firms deciding whether to buy an off-the-shelf weed-detection model, quantify the domain gap between temperate open-field UAV datasets such as WeedsGalore and PhenoBench and drone frames from a partner archive of tropical leafy-vegetable farms, producing a calibrated deploy-without-retraining score.",
    "region": "singapore",
    "bucket": "drone_and_aerial",
    "data_class": "open_uav_dataset:WeedsGalore+PhenoBench",
    "delta_claim": "Produces a calibrated domain-gap deployment score, not another crop or weed segmentation model.",
    "seed_urls": [
      {
        "url": "https://arxiv.org/abs/2502.13103",
        "date": "2025-02",
        "tier": "A",
        "title": "WeedsGalore: A Multispectral and Multitemporal UAV-based Dataset for Crop and Weed Segmentation",
        "note": "WACV 2025 open UAV dataset for temperate maize-field weed segmentation."
      },
      {
        "url": "https://arxiv.org/abs/2306.04557",
        "date": "2023-06",
        "tier": "A",
        "title": "PhenoBench: A Large Dataset and Benchmarks for Semantic Image Interpretation in the Agricultural Domain",
        "note": "Open UAV dataset, temperate sugar-beet fields, pixel-wise crop/weed/leaf annotations."
      }
    ],
    "crowded_area_entered": false,
    "hunter_confidence": "low"
  },
  {
    "one_liner": "For Singapore and Malaysia drone-service firms such as Aonic and Meraque, screen raw geotagged frames and flight metadata straight off the aircraft to flag orthomosaic-stitching failures such as blur, ghosting and misregistration before the multi-hour stitching job runs, cutting their current days-long fly-stitch-inspect cycle.",
    "region": "singapore",
    "bucket": "drone_and_aerial",
    "data_class": "raw_frames_with_metadata",
    "delta_claim": "Pre-stitch raw-frame QA gate for stitching artifacts, not a spray, count or health analytics product.",
    "seed_urls": [
      {
        "url": "https://resource.aonic.com/event/maha-2026/",
        "date": "2026-08-28",
        "tier": "A",
        "title": "MAHA 2026 - Aonic Resource Hub",